ability_id,source_type,source_id,name,text,source_file
beed-356b-2fec-2c2a:brutal-raider:5676-8bc3-fdc1-cd3c,unit,beed-356b-2fec-2c2a,Brutal Raider,"Each time this model's unit ends a Charge move, until the end of the turn, add 1 to the Strength characteristic of melee weapons equipped by this model and improve the Armour Penetration characteristic of those weapons by 1.",Chaos - Chaos Space Marines.cat
beed-356b-2fec-2c2a:raider's-due:40da-ec25-a606-f6d6,unit,beed-356b-2fec-2c2a,Raider's Due,"Each time this unit declares a Charge that targets one or more units that are within range of one or more objective markers, you can re-roll the Charge roll.",Chaos - Chaos Space Marines.cat
beed-356b-2fec-2c2a:leader:312d-b603-949a-e8dd,unit,beed-356b-2fec-2c2a,Leader,"This model can be attached to the following units: ^^**Chosen, Legionaries, Red Corsairs Raiders**^^",Chaos - Chaos Space Marines.cat
b9a4-a9c4-5f8d-ed3a:leader:458a-f7f3-eafd-2ff8,unit,b9a4-a9c4-5f8d-ed3a,Leader,"This model can be attached to the following units: ^^**Chosen, Havocs, Legionaries, Nemesis Claw, Raiders**^^",Chaos - Chaos Space Marines.cat
b9a4-a9c4-5f8d-ed3a:marked-by-the-dark-gods:a19f-21a9-4bec-2ddd,unit,b9a4-a9c4-5f8d-ed3a,Marked by the Dark Gods,"Each time this model makes an attack, a successful unmodified Hit roll of 5+ scores a Critical Hit.",Chaos - Chaos Space Marines.cat
b6c0-4be6-7487-73dc:leader:943f-a7de-f482-bb66,unit,b6c0-4be6-7487-73dc,Leader,"This model can be attached to the following units: ^^**Chosen, Havocs, Legionaries, Nemesis Claw, Raiders**^^",Chaos - Chaos Space Marines.cat
b6c0-4be6-7487-73dc:gift-of-chaos-(psychic):1f87-b4f7-73b2-0e2b,unit,b6c0-4be6-7487-73dc,Gift of Chaos (Psychic),"Each time this model is selected to shoot or fight, after resolving its attacks, select one enemy unit hit by one or more of those attacks that had the [^^PSYCHIC^^} ability. That unit must take a Leadership test. If it fails, it suffers D3 mortal wounds.",Chaos - Chaos Space Marines.cat
9573-8b24-3796-d9d9:leader:ba42-57a4-3e54-4ff7,unit,9573-8b24-3796-d9d9,Leader,"This model can be attached to the following units: ^^**Chosen, Havocs, Legionaries, Nemesis Claw, Raiders**^^",Chaos - Chaos Space Marines.cat
9573-8b24-3796-d9d9:skulking-nightmare:f709-520f-163e-cbcf,unit,9573-8b24-3796-d9d9,Skulking Nightmare,"While this model is within 3"" of one or more friendly ^^**Heretic Astartes Infantry**^^ units, this model has the Lone Operative ability.",Chaos - Chaos Space Marines.cat
9573-8b24-3796-d9d9:invulnerable-save-(5+):e473-6d70-e3bc-6198,unit,9573-8b24-3796-d9d9,Invulnerable Save (5+),This model has a 5+ invulnerable save.,Chaos - Chaos Space Marines.cat
29f9-fc47-787e-d9d3:scuttling-walker:6050-f4cc-b075-e5cf,unit,29f9-fc47-787e-d9d3,Scuttling Walker,"Each time this unit makes a Normal, Advance or Fall Back move, it can move through models (excluding ^^**Titanic**^^ models) and terrain features. When doing so, it can move within Engagement Range of enemy models, but cannot end that move within Engagement Range of them, and any Desperate Escape test is automatically passed.",Chaos - Chaos Space Marines.cat
29f9-fc47-787e-d9d3:daemonforge:68ed-ed87-1f92-c6e6,unit,29f9-fc47-787e-d9d3,Daemonforge,"Each time this unit makes a Dark Pact, until the end of the phase, each time this model makes an attack, re-roll a Wound roll of 1. In addition, once per battle, when this unit makes a Dark Pact, before making the resulting Leadership test, you can declare it will overcharge its daemonforge. If it does: 
- If the resulting Leadership test is failed, this model suffers 3 mortal wounds instead of D3 mortal wounds.
- Until the end of the phase, each time this model makes an attack, you can re-roll the Wound roll.",Chaos - Chaos Space Marines.cat
eec8-c21f-c284-a682:headlong-destruction:dd97-3f1f-328b-3e82,unit,eec8-c21f-c284-a682,Headlong Destruction,"Each time a model in this unit makes an attack that targets the closest eligible enemy unit, improve the Armour Penetration characteristic of that attack by 1.",Chaos - Chaos Space Marines.cat
eec8-c21f-c284-a682:architect-of-ruin:ef2f-d232-e25b-83a0,unit,eec8-c21f-c284-a682,Architect of Ruin,"At the start of the battle, select one unit in your opponent’s army to be this model’s hated foe. Each time this model makes an attack that targets its hated foe, you can re-roll the Wound roll. Each time this model’s hated foe is destroyed, you can select a new unit from your opponent’s army to be its hated foe.",Chaos - Chaos Space Marines.cat
eec8-c21f-c284-a682:leader:f2db-ce7a-312b-bdb2,unit,eec8-c21f-c284-a682,Leader,"This model can be attached to the following units: ^^**Chaos Terminator Squad, Mutilators, Obliterators.**^^",Chaos - Chaos Space Marines.cat
4cb3-e6b6-4e82-23bf:death-guard-defenders:a62-2152-78a8-d7c8,unit,4cb3-e6b6-4e82-23bf,Death Guard Defenders,"While this model is within 3"" of one or more friendly ^^**Death Guard Infantry^^** units, this model has the Lone Operative ability.",Chaos - Death Guard.cat
4cb3-e6b6-4e82-23bf:invulnerable-save:6e8c-70d5-2b8f-2b2c,unit,4cb3-e6b6-4e82-23bf,Invulnerable Save,This model has a 4+ invulnerable save.,Chaos - Death Guard.cat
4cb3-e6b6-4e82-23bf:fevered-strategist:0f8a-2008-862e-8af6,unit,4cb3-e6b6-4e82-23bf,Fevered Strategist,"Once per Battle Round, one model from your army with this ability can use it when a friendly ^^**Death Guard^^** unit within 12"" of that model is targeted with a Stratagem. If it does, reduce the CP cost of that Stratagem by 1CP.",Chaos - Death Guard.cat
4cb3-e6b6-4e82-23bf:miasma-of-pestilence-(aura):0c92-aa1c-c7e5-a527,unit,4cb3-e6b6-4e82-23bf,Miasma of Pestilence (Aura),"While a friendly ^^**Death Guard^^** unit is within 6"" of this model, each time a ranged attack targets that unit, models in that unit have the Benefit of Cover against that attack.",Chaos - Death Guard.cat
f4d7-244d-16c4-f2f3:horrifying-visage:8ce2-6dec-6caf-3777,unit,f4d7-244d-16c4-f2f3,Horrifying Visage,"Each time this model ends a Charge move, select one enemy unit within Engagement Range of it. That unit must take a Battle-shock test, subtracting 1 from that test.",Chaos - Death Guard.cat
f4d7-244d-16c4-f2f3:invulnerable-save:d376-c886-6c02-923f,unit,f4d7-244d-16c4-f2f3,Invulnerable Save,This model has a 4+ invulnerable save.,Chaos - Death Guard.cat
f4d7-244d-16c4-f2f3:enfeebling-miasma-(aura):e98-fdf-85f6-5c44,unit,f4d7-244d-16c4-f2f3,Enfeebling Miasma (Aura),"While an enemy unit (excluding ^^*Monsters^^** and ^^**Vehicles^^**) is within 6"" of this model, each time that unit is selected to Fall Back, models in that enemy unit must take Desperate Escape tests. When doing so, if that enemy unit is Battle-shocked, subtract 1 from each of those Desperate Escape tests.",Chaos - Death Guard.cat
e6a4-7055-fd23-5123:leader:77d-6b50-56be-1c71,unit,e6a4-7055-fd23-5123,Leader,"This model can be attached to the following units:
■ ^^**Blightlord Terminators^^**
■ ^^**Deathshroud Terminators^^**
■ ^^**Poxwalkers^^**",Chaos - Death Guard.cat
e6a4-7055-fd23-5123:invulnerable-save:2e89-e2c6-f499-e2b,unit,e6a4-7055-fd23-5123,Invulnerable Save,This model has a 4+ invulnerable save.,Chaos - Death Guard.cat
e6a4-7055-fd23-5123:the-destroyer-hive:e1de-40a6-c9a9-7316,unit,e6a4-7055-fd23-5123,The Destroyer Hive,"While this model is leading a unit, each time a melee attack targets that unit, subtract 1 from the Hit roll.",Chaos - Death Guard.cat
e6a4-7055-fd23-5123:eater-plague-(psychic):595f-4a7d-3845-2131,unit,e6a4-7055-fd23-5123,Eater Plague (Psychic),"In your Shooting phase, you can select one enemy unit within 18"" of and visible to this ^^**Psyker^^** (excluding units with the Lone Operative ability that are not part of an Attached unit and are not within 12"" of this ^^**Psyker^^** and roll one D6: on a 1, this ^^**Psyker^^**'s unit suffers D3 mortal wounds; on a 2-5, that enemy unit suffers D6 mortal wounds; on a 6, that enemy unit suffers D3+3 mortal wounds.",Chaos - Death Guard.cat
cfc1-1741-530c-3335:invulnerable-save:f34e-24da-8f79-a9c2,unit,cfc1-1741-530c-3335,Invulnerable Save,This model has a 4+ invulnerable save.,Chaos - Death Guard.cat
cfc1-1741-530c-3335:leader:b29a-947-acbe-1eba,unit,cfc1-1741-530c-3335,Leader,"This model can be attached to the following unit:
■ PLAGUE MARINES",Chaos - Death Guard.cat
bacc-4f1-649-a051:invulnerable-save:fe5a-2fe9-242a-d7fb,unit,bacc-4f1-649-a051,Invulnerable Save,This model has a 4+ invulnerable save.,Chaos - Death Guard.cat
bacc-4f1-649-a051:leader:90a2-1895-2e96-d987,unit,bacc-4f1-649-a051,Leader,"This model can be attached to the following units:
■ BLIGHTLORD TERMINATORS
■ DEATHSHROUD TERMINATORS",Chaos - Death Guard.cat
c15c-2b5a-dcab-7627:invulnerable-save:e36d-3711-9601-488b,unit,c15c-2b5a-dcab-7627,Invulnerable Save,This model has a 4+ invulnerable save.,Chaos - Death Guard.cat
c15c-2b5a-dcab-7627:virulent-aura:c011-8b42-c9f3-e3cc,unit,c15c-2b5a-dcab-7627,Virulent Aura,"While this model is leading a unit, each time a model in that unit makes a ranged attack, you can re-roll the Wound roll.",Chaos - Death Guard.cat
c15c-2b5a-dcab-7627:blight-bombardment:b-b5eb-2ac6-b6df,unit,c15c-2b5a-dcab-7627,Blight Bombardment,"At the start of your Shooting phase, select one enemy unit within 30"" of and visible to this model. Until the end of the phase, each time a friendly ^^**Death Guard^^** unit makes a ranged attack that targets that unit, re-roll a Hit roll of 1 (if that attack is made with a Blast weapon, you can re-roll the Hit roll instead).",Chaos - Death Guard.cat
c15c-2b5a-dcab-7627:leader:e778-6ccb-2016-6cb5,unit,c15c-2b5a-dcab-7627,Leader,"This model can be attached to the following units:
- ^^**Blightlord Terminators^^**
- ^^**Deathshroud Terminators^^**",Chaos - Death Guard.cat
8700-3d3-efbb-ef8d:invulnerable-save:8af0-9fb3-8fa-a1e0,unit,8700-3d3-efbb-ef8d,Invulnerable Save,This model has a 4+ invulnerable save.,Chaos - Death Guard.cat
8700-3d3-efbb-ef8d:vector-of-disease:df3c-ad72-1ad5-4d0d,unit,8700-3d3-efbb-ef8d,Vector of Disease,"While this model is leading a unit, melee weapons equipped by models in that unit have the **[Sustained Hits 1]** and **[Lance]** abilties.",Chaos - Death Guard.cat
8700-3d3-efbb-ef8d:unholy-resilience:e96b-953c-dbe9-f622,unit,8700-3d3-efbb-ef8d,Unholy Resilience,"The first time a model with this ability is destroyed in a battle round, roll one D6 at the end of the phase. On a 2+, set that model back up on the battlefield, as close as possible to where it was destroyed and not within Engagement Range of any enemy units, with 3 wounds remaining. Each model can only be set up in this way once per battle.",Chaos - Death Guard.cat
8700-3d3-efbb-ef8d:leader:a73f-4b0f-de8f-e10e,unit,8700-3d3-efbb-ef8d,Leader,"This model can be attached to the following units:
- ^^**Blightlord Terminators^^**
- ^^**Deathshroud Terminators^^**",Chaos - Death Guard.cat
93ac-1b31-4238-d60e:invulnerable-save:225b-dcc0-3a88-11bb,unit,93ac-1b31-4238-d60e,Invulnerable Save,This model has a 4+ invulnerable save.,Chaos - Death Guard.cat
93ac-1b31-4238-d60e:leader:339e-1933-3dbf-e355,unit,93ac-1b31-4238-d60e,Leader,"This model can be attached to the following units:
■ BLIGHTLORD TERMINATORS
■ DEATHSHROUD TERMINATORS",Chaos - Death Guard.cat
93ac-1b31-4238-d60e:putrescent-vitality-(psychic):c9ea-1d59-9bf-bb00,unit,93ac-1b31-4238-d60e,Putrescent Vitality (Psychic),"At the start of the Fight phase, you can roll one D6: on a 1, this PSYKER’s unit suffers D3 mortal wounds; on a 2+, until the end of the phase, each time an attack is allocated to a model in this PSYKER’s unit, subtract 1 from the Damage characteristic of that attack.",Chaos - Death Guard.cat
93ac-1b31-4238-d60e:pestilent-familiar-(psychic):6dc6-e465-e8ff-a4eb,unit,93ac-1b31-4238-d60e,Pestilent Familiar (Psychic),"Once per battle, after selecting targets for a Psychic weapon equipped by this model, until the end of the phase, improve the Strength and Damage characteristics of that weapon by 2.",Chaos - Death Guard.cat
9900-77d7-10e3-5c91:gift-of-contagion-(psychic):20c4-9b25-4f77-852e,unit,9900-77d7-10e3-5c91,Gift of Contagion (Psychic),"While this model is leading a unit, each time a model in that unit makes an attack which targets a unit which is Afflicted, that attack has the [Sustained Hits 1] ability.",Chaos - Death Guard.cat
9900-77d7-10e3-5c91:pestilent-fallout-(psychic):4108-2036-c473-aa46,unit,9900-77d7-10e3-5c91,Pestilent Fallout (Psychic),"In your Shooting phase, after this model has shot, select one enemy ^^**Infantry^^** unit hit by one or more of those attacks made with its Plague Wind. Until the end of your opponent's next turn, that unit is enfeebled. While a unit is enfeebled, subtract 2"" from the Move characteristic of models in that unit.",Chaos - Death Guard.cat
9900-77d7-10e3-5c91:leader:290-e59f-d3bd-9a68,unit,9900-77d7-10e3-5c91,Leader,"This model can be attached to the following units:
^^**Plague Marines^^**, ^^**Poxwalkers^^**",Chaos - Death Guard.cat
8467-b3a2-2597-de0d:infused-with-the-blessings-of-nurgle:90ad-b6be-844c-365d,unit,8467-b3a2-2597-de0d,Infused with the Blessings of Nurgle,"In your Shooting phase, each time this unit is selected to shoot, after this unit has shot, select one enemy unit hit by one or more of those attacks. Until the start of your next turn, that unit is Afflicted.",Chaos - Death Guard.cat
7c30-1e92-2faa-eb03:curse-of-the-walking-pox:ad92-6478-18b8-6222,unit,7c30-1e92-2faa-eb03,Curse of the Walking Pox,"Each time a ^^**Poxwalker^^** model in this unit makes an attack that destroys an enemy model (excluding ^^**Monster^^** and ^^**Vehicle^^** models), after this unit has resolved its attacks, you can return one destroyed ^^**Poxwalker^^** model to this unit.

While ^^**Typhus^^** is leading this unit, enemy models destroyed as a result of ^^**Typhus^^**’ Eater Plague ability count as enemy models destroyed by an attack made by a ^^**Poxwalker^^** model in this unit for the purposes of this ability.",Chaos - Death Guard.cat
1ffc-27de-8aea-e7bb:sickening-vitality:67fb-5245-68ef-56de,unit,1ffc-27de-8aea-e7bb,Sickening Vitality,"While this model is leading a unit, add 1"" to the Move characteristic of models in that unit and you can re-roll Advance and Charge rolls made for that unit.",Chaos - Death Guard.cat
1ffc-27de-8aea-e7bb:tocsin-of-misery-(aura):617e-b283-8a90-df5a,unit,1ffc-27de-8aea-e7bb,Tocsin of Misery (Aura),"In the Battle-shock step of your opponent's Command phase, if an enemy unit that is below its Starting Strength is within 9"" of this model, that enemy unit must take a Battle-shock test, subtracting 1 from that test if it is a ^^**Psyker^^** unit.",Chaos - Death Guard.cat
1ffc-27de-8aea-e7bb:leader:5df1-a522-e690-dddc,unit,1ffc-27de-8aea-e7bb,Leader,"This model can be attached to the following units: ^^**Plague Marines^^**, ^^**Poxwalkers^^**
*You can attach this model to a ^^**Plague Marines^^** or ^^**Poxwalkers^^** unit, even if one other Leader unit has already been attached to it (you cannot attach more than one of the same Leader to the same unit). If you do, and that Bodyguard unit is destroyed, the Leader units attached to it become separate units, with their original Starting Strengths.*",Chaos - Death Guard.cat
c88f-d4dc-84b3-1b31:putrefying-stink:f33c-eeb8-429d-2a2f,unit,c88f-d4dc-84b3-1b31,Putrefying Stink,"Enemy models cannot start or end an Advance move within 9"" of this model.",Chaos - Death Guard.cat
c88f-d4dc-84b3-1b31:blinding-spray:be78-8c3d-c31a-67f5,unit,c88f-d4dc-84b3-1b31,Blinding Spray,"In the Fight phase, you can select one model from your army with this ability to use this ability. If you do, until the end of that phase, that model's unit has the Fights First ability. Each model can only be selected for this ability once per battle.",Chaos - Death Guard.cat
690b-a189-5935-f32e:extraction-of-fresh-disease:ebdf-6359-5f8e-4079,unit,690b-a189-5935-f32e,Extraction of Fresh Disease,"The first time this model's unit destroys an enemy unit as a result of a melee attack, until the end of the battle, add 6 to the Objective Control characteristic of this model.",Chaos - Death Guard.cat
690b-a189-5935-f32e:foul-infusion:a1e3-4ac3-299c-1417,unit,690b-a189-5935-f32e,Foul Infusion,"While this model is leading a unit, weapons equipped by models in that unit have the [Lethal Hits] ability. In addition, each time a model in that unit makes an attack, a Critical Hit is scored on an unmodified Hit roll of 5+, instead of only on a 6.",Chaos - Death Guard.cat
506c-16a8-68f7-c08a:malicious-calculations:4b43-4623-e0e1-f159,unit,506c-16a8-68f7-c08a,Malicious Calculations,"While this model is leading a unit, each time a model in that unit makes an attack, you can ignore any or all modifiers to that attack's Ballistic Skill or Weapon Skill characteristics and/or any or all modifiers to the Hit roll.",Chaos - Death Guard.cat
506c-16a8-68f7-c08a:seven-fold-chant:a8a2-18de-801d-6470,unit,506c-16a8-68f7-c08a,Seven-fold Chant,"In your Command phase, if this model is on the battlefield, roll 2D6: on a 7+, you gain 1CP.",Chaos - Death Guard.cat
9a82-ea13-3511-6c08:tainted-narthecium:61c7-91ec-614-fa78,unit,9a82-ea13-3511-6c08,Tainted Narthecium,"While this model is leading a unit, in your Command phase, you can return 1 destroyed Bodyguard model to that unit.",Chaos - Death Guard.cat
9a82-ea13-3511-6c08:inflamed-infections:96ee-97c4-3b67-e45,unit,9a82-ea13-3511-6c08,Inflamed Infections,"At the start of the Fight phase, select one enemy unit within Engagement Range of this model. Until the end of the phase, each time this model makes an attack that targets that unit, an unmodified Hit roll of 5+ scores a Critical Hit. If that unit is below Half-strength, an unmodified Hit roll of 4+ scores a Critical Hit instead.",Chaos - Death Guard.cat
83e8-ebb7-785a-2115:silent-bodyguard:a4ac-68a4-3849-3695,unit,83e8-ebb7-785a-2115,Silent Bodyguard,"While a ^^**Character^^** model is leading this unit, that ^^**Character^^** model has the Feel No Pain 4+ ability.",Chaos - Death Guard.cat
83e8-ebb7-785a-2115:invulnerable-save:71fc-4706-77d0-25e9,unit,83e8-ebb7-785a-2115,Invulnerable Save,Models in this unit have a 4+ invulnerable save.,Chaos - Death Guard.cat
83e8-ebb7-785a-2115:death-approaches:4245-0a58-3995-1671,unit,83e8-ebb7-785a-2115,Death Approaches,"In your Movement phase, when this unit is set up on the battlefield using the Deep Strike ability, it can be set up anywhere on the battlefield that is more than 6"" horizontally away from all Afflicted enemy units, and more than 9"" horizontally away from any other enemy units.",Chaos - Death Guard.cat
2a2b-643e-860e-b524:diseased-malice:39dd-f8e7-418a-a141,unit,2a2b-643e-860e-b524,Diseased Malice,"Each time this model makes an attack that targets an Afflicted unit, add 1 to the Wound roll.",Chaos - Death Guard.cat
2a2b-643e-860e-b524:froth-spattered-frenzy:af7f-a1a3-d20e-9c,unit,2a2b-643e-860e-b524,Froth-spattered Frenzy,"If this model is equipped with two melee weapons in addition to its close combat weapon, add 2 to the Attacks characteristic of those two weapons.",Chaos - Death Guard.cat
5b4e-dcf1-5c6f-4d35:invulnerable-save:75a9-938d-b369-6d81,unit,5b4e-dcf1-5c6f-4d35,Invulnerable Save,Models in this unit have a 4+ invulnerable save.,Chaos - Death Guard.cat
5b4e-dcf1-5c6f-4d35:blistering-fusillade:c485-d6a6-8913-c29a,unit,5b4e-dcf1-5c6f-4d35,Blistering Fusillade,"If this unit has a Starting Strength of 5 or more, or if a ^^**Character^^** is leading this unit, then each time a model in this unit makes a ranged attack that targets an Afflicted unit, improve the Strength and Armour Penetration characteristics of that attack by 1.",Chaos - Death Guard.cat
1d85-475f-5ab-9823:lethal-ichor:345b-e060-85c4-3a04,unit,1d85-475f-5ab-9823,Lethal Ichor,"Each time a melee attack is allocated to a model in this unit, after the attacking unit has finished making its attacks, roll one D6 (to a maximum of six D6 per attacking unit): for each 4+, the attacking unit suffers 1 mortal wound.",Chaos - Death Guard.cat
35b2-7490-1a7b-cd99:tank-hunters:e47-254c-cdf9-7c5e,unit,35b2-7490-1a7b-cd99,Tank Hunters,"In your Shooting phase, each time a model in this unit makes a attack that targets a ^^**Monster^^** or ^^**Vehicle^^** unit, add 1 to the Hit roll and add 1 to the Wound roll.",Chaos - Death Guard.cat
35b2-7490-1a7b-cd99:invulnerable-save:f24e-d919-2175-70bb,unit,35b2-7490-1a7b-cd99,Invulnerable Save,Models in this unit have a 5+ invulnerable save.,Chaos - Death Guard.cat
26d5-ec73-3517-f3f:hovering-death:b2e1-4694-48b-7f46,unit,26d5-ec73-3517-f3f,Hovering Death,This model is eligible to shoot and declare a charge in a turn in which it Fell Back.,Chaos - Death Guard.cat
26d5-ec73-3517-f3f:invulnerable-save:57ad-7a0a-db8a-312e,unit,26d5-ec73-3517-f3f,Invulnerable Save,This model has a 5+ invulnerable save.,Chaos - Death Guard.cat
e58b-507a-937f-7abf:spore-laced-shock-waves:51dd-7b91-7f32-bd8f,unit,e58b-507a-937f-7abf,Spore-laced Shock Waves,"In your Shooting phase, each time you select a target for this model's Plagueburst mortar, roll one D6 for the target unit and every other enemy unit within 3"" of the target unit, adding 1 to that roll if the unit being rolled for is Afflicted. On a 6+, the unit being rolled for is struck by spores; after resolving all of this model's attacks against the target unit, each unit struck by spores suffers D3 mortal wounds.",Chaos - Death Guard.cat
e58b-507a-937f-7abf:invulnerable-save:85e5-391a-502b-3260,unit,e58b-507a-937f-7abf,Invulnerable Save,This model has a 5+ invulnerable save.,Chaos - Death Guard.cat
89d-b0c0-6e19-f017:assault-ramp:4fa1-d53f-feff-9180,unit,89d-b0c0-6e19-f017,Assault Ramp,"Each time a unit disembarks from this model after it has made a Normal move, that unit is still eligible to declare a charge this turn.",Chaos - Death Guard.cat
9b58-210d-c12f-4d46:metalophagic-infection:a5c8-bcd-15d5-32ae,unit,9b58-210d-c12f-4d46,Metalophagic Infection,"In your Shooting phase, after this model has shot, select one enemy ^^**Monster^^** or ^^**Vehicle^^** unit hit by one or more of those attacks. Roll one D6, adding 1 to the result if that unit is Afflicted; on a 5+, that unit suffers D3 mortal wounds.",Chaos - Death Guard.cat
ab4e-466d-e9e8-89d5:hail-of-corrosive-disease:d42e-f8ea-a29a-2766,unit,ab4e-466d-e9e8-89d5,Hail of Corrosive Disease,"In your Shooting phase, after this model has shot, select one enemy unit (excluding ^^**Monsters^^** and ^^**Vehicles^^**) hit by one or more of those attacks. Until the end of the phase, each time a friending ^^**Death Guard^^** unit makes a ranged attack that targets that enemy unit, improve the Armour Penetration characteristic of that attack by 1. The same enemy unit can only be affected by this ability once per phase.",Chaos - Death Guard.cat
b899-92e2-693a-975f:fire-support:c0c9-74ff-68a4-bbec,unit,b899-92e2-693a-975f,Fire Support,"In your Shooting phase, after this model has shot, select one enemy unit hit by one or more of those attacks. Until the end of the phase, each time a friendly model that disembarked from this ^^**Transport**^^ this turn makes an attack that targets that unit, you can re-roll the Wound roll.",Chaos - Death Guard.cat
f5ac-4f37-fe7b-36b6:host-of-plagues:f80d-c92e-8aa-d3d1,unit,f5ac-4f37-fe7b-36b6,Host of Plagues,"At the end of your Movement phase, roll one D6 for each enemy unit within 6"" of this model, adding 1 to the result if that unit is Afflicted; on a 3+, that enemy unit suffers D3 mortal wounds.",Chaos - Death Guard.cat
f5ac-4f37-fe7b-36b6:lord-of-the-death-guard:5ab4-d691-93a8-3d21,unit,f5ac-4f37-fe7b-36b6,Lord of the Death Guard,"Once per turn, this model can use one of the Lord of the Death Guard abilties.",Chaos - Death Guard.cat
f5ac-4f37-fe7b-36b6:damaged:-1-6-wounds-remaining:518f-419c-f428-4fb9,unit,f5ac-4f37-fe7b-36b6,Damaged: 1-6 wounds remaining,"While this model has 1-6 wounds remaining, each time this model makes an attack, subtract 1 from the Hit roll.",Chaos - Death Guard.cat
f5ac-4f37-fe7b-36b6:invulnerable-save:ec28-bdc7-e123-b319,unit,f5ac-4f37-fe7b-36b6,Invulnerable Save,This model has a 4+ invulnerable save.,Chaos - Death Guard.cat
3e5b-23db-4ccd-ea97:unclean-icon:b063-b5e6-8bb1-83ab,unit,3e5b-23db-4ccd-ea97,Unclean Icon,"While this model is leading a unit, add 1 to the Objective Control characteristic of models in that unit.",Chaos - Death Guard.cat
3e5b-23db-4ccd-ea97:blessed-icon-of-disease:57f2-2abe-dcb7-2355,unit,3e5b-23db-4ccd-ea97,Blessed Icon of Disease,"Once per battle, at the start of any phase, you can select one friendly ^^**Death Guard^^** unit that is Battle-shocked and within 12"" of this model. That unit is no longer Battle-shocked.",Chaos - Death Guard.cat
55c7-e5b8-9737-f58e:putrescent-fog-(aura):f006-4a66-c5fb-edcd,unit,55c7-e5b8-9737-f58e,Putrescent Fog (Aura),"Enemy units that are set up on the battlefield as Reinforcements cannot be set up within 12"" of this model.",Chaos - Death Guard.cat
55c7-e5b8-9737-f58e:diseased-cover:7d03-829f-56a1-940d,unit,55c7-e5b8-9737-f58e,Diseased Cover,"Each time a ranged attack is allocated to a model, if that model is not fully visible to every model in the attacking unit because of this **^^Fortification^^**, that model has the Benefit of Cover against that attack.",Chaos - Death Guard.cat
55c7-e5b8-9737-f58e:deployment:2e2d-33de-e666-96f9,unit,55c7-e5b8-9737-f58e,Deployment,"Both parts of this ^^**Fortification**^^ must be deployed within 1"" of each other. Both parts are then treated as a single model for all rules purposes.",Chaos - Death Guard.cat
1d25-87a1-2d17-5d02:invulnerable-save:4acd-b3e5-379b-bd38,unit,1d25-87a1-2d17-5d02,Invulnerable Save,This model has a 4+ invulnerable save.,Chaos - Death Guard.cat
1d25-87a1-2d17-5d02:leader:eb81-795f-f750-12f7,unit,1d25-87a1-2d17-5d02,Leader,"This model can be attached to the following unit:
■ CHOSEN
■ LEGIONARIES
■ PLAGUE MARINES",Chaos - Death Guard.cat
