ability_id,source_type,source_id,name,text,source_file
73fc-a193-7da1-d9c4:incensor-cherub:1499-da67-d675-dba5,unit,73fc-a193-7da1-d9c4,Incensor Cherub,"Once per battle, you can target this unit with the Command Re-roll Stratagem for 0CP and can do so if you have already targeted a different unit with that Stratagem this phase.",Imperium - Agents of the Imperium.cat
73fc-a193-7da1-d9c4:invulnerable-save:7db8-5b7f-87f5-2796,unit,73fc-a193-7da1-d9c4,Invulnerable Save,Models in this unit have a 6+ invulnerable save.,Imperium - Agents of the Imperium.cat
a5c9-2cb7-d874-8169:transport:7f12-782b-ccb8-c711,unit,a5c9-2cb7-d874-8169,Transport,"This model has a transport capacity of 6 ORDO HERETICUS INFANTRY models.

At the start of the Declare Battle Formations step, you can select one SISTERS OF BATTLE SQUAD from your army. If you do, that unit is split into two units, each containing as equal a number of models as possible (when splitting a unit in this way, make a note of which models form each of the two new units). One of these units must start the battle embarked within this TRANSPORT; the other can start the battle embarked within another TRANSPORT, or it can be deployed as a separate unit.",Imperium - Agents of the Imperium.cat
a5c9-2cb7-d874-8169:purge-and-cleanse:63f5-e162-abaf-9a62,unit,a5c9-2cb7-d874-8169,Purge and Cleanse,"Each time this model has shot, select one enemy unit hit by one or more of those attacks. Until the end of the phase, that enemy unit cannot have the Benefit of Cover.",Imperium - Agents of the Imperium.cat
a5c9-2cb7-d874-8169:invulnerable-save:b9b5-f542-9dfc-e768,unit,a5c9-2cb7-d874-8169,Invulnerable Save,This model has a 6+ invulnerable save.,Imperium - Agents of the Imperium.cat
fac5-a242-951a-e1b2:malefic-warding:bb60-f780-ef5f-7987,unit,fac5-a242-951a-e1b2,Malefic Warding,"While an INQUISITOR model is leading a unit that contains one or more DAEMONHOST models, models in this unit have a 5+ invulnerable save.",Imperium - Agents of the Imperium.cat
fac5-a242-951a-e1b2:invulnerable-save:7dc5-28d0-e574-54a2,unit,fac5-a242-951a-e1b2,Invulnerable Save,Models in this unit have a 5+ invulnerable save.,Imperium - Agents of the Imperium.cat
fac5-a242-951a-e1b2:bound-daemon:8b06-5f1e-5f34-ca2a,unit,fac5-a242-951a-e1b2,Bound Daemon,"While an INQUISITOR model is leading a unit that includes one or more DAEMONHOST models, the Objective Control characteristic of DAEMONHOST models in that unit is 1.",Imperium - Agents of the Imperium.cat
fac5-a242-951a-e1b2:inquisitorial-retinue:b101-9bad-78b9-f996,unit,fac5-a242-951a-e1b2,Inquisitorial Retinue,"If your Army Faction is not AGENTS OF THE IMPERIUM, then for each unique pairing of 1 INQUISITORIAL AGENTS unit and 1 DAEMONHOST unit occuring in your army, increase the maximum number of RETINUE units permitted in your army by 1. At the start of the Declare Battle Formations step, this unit can join one INQUISITORIAL AGENTS unit from your army that is being led by an INQUISITOR model (a unit cannot have more than one DAEMONHOST unit joined to it). If it does, until the end of the battle, every model in this unit counts as being part of that Bodyguard unit, and that Bodyguard unit’s Starting Strength is increased accordingly.",Imperium - Agents of the Imperium.cat
bd54-3e9f-3f7d-ad5a:inconceivable-augmentation:da04-98f6-a254-edae,unit,bd54-3e9f-3f7d-ad5a,Inconceivable Augmentation,"While this model is leading a unit, ranged weapons equipped by models in that unit have the [LETHAL HITS] ability.",Imperium - Agents of the Imperium.cat
bd54-3e9f-3f7d-ad5a:leader:6dec-3f3f-834e-29cc,unit,bd54-3e9f-3f7d-ad5a,Leader,"This model can be attached to the following units: 
■ Inquisitorial Agents

*You can attach this model to an INQUISITORIAL AGENTS unit, even if one INQUISITOR unit has already been attached to it. If you do, and that Bodyguard unit is destroyed, the Leader units attached to it become separate units, with their original Starting Strengths.*",Imperium - Agents of the Imperium.cat
bd54-3e9f-3f7d-ad5a:invulnerable-save:327a-98f1-666a-2e5a,unit,bd54-3e9f-3f7d-ad5a,Invulnerable Save,This model has a 4+ invulnerable save.,Imperium - Agents of the Imperium.cat
bd54-3e9f-3f7d-ad5a:inquisitorial-agent:7d7c-3a51-e693-0672,unit,bd54-3e9f-3f7d-ad5a,Inquisitorial Agent,"If your Army Faction is not AGENTS OF THE IMPERIUM, then for each unique pairing of 1 INQUISITORIAL AGENTS unit and 1 JOKAERO WEAPONSMITH unit occuring in your army, increase the maximum number of CHARACTER units permitted in your army by 1.",Imperium - Agents of the Imperium.cat
"bd54-3e9f-3f7d-ad5a:a-weaponsmith,-not-a-warlord:4ce7-15a8-4958-3b4e",unit,bd54-3e9f-3f7d-ad5a,"A Weaponsmith, Not a Warlord","This model cannot be selected to be your Warlord. While an INQUISITOR model is leading a unit that includes one or more JOKAERO WEAPONSMITH models, the Objective Control characteristic of JOKAERO WEAPONSMITH models in that unit is 1.",Imperium - Agents of the Imperium.cat
8b98-0ac7-a0ba-dedf:blackstar-cluster-launcher:bdc3-5be2-5891-987b,unit,8b98-0ac7-a0ba-dedf,Blackstar Cluster Launcher,"Each time this model ends a Normal move, you can select one enemy unit it moved over during that move and roll six D6: for each 5+, that unit suffers 1 mortal wound.",Imperium - Agents of the Imperium.cat
8b98-0ac7-a0ba-dedf:damaged:-1-5-wounds-remaining:b96c-8339-3322-a92e,unit,8b98-0ac7-a0ba-dedf,Damaged: 1-5 Wounds Remaining,"While this model has 1-5 wounds remaining, each time this model makes an attack, subtract 1 from the Hit roll.",Imperium - Agents of the Imperium.cat
8b98-0ac7-a0ba-dedf:transport:8caa-45ec-02cc-cb5e,unit,8b98-0ac7-a0ba-dedf,Transport,This model has a transport capacity of 12 DEATHWATCH INFANTRY models.,Imperium - Agents of the Imperium.cat
0744-61ce-619d-ffe1:death-to-the-alien:f077-6b42-7739-96f7,unit,0744-61ce-619d-ffe1,Death to the Alien,"Each time a model in this unit makes an attack, re-roll a Hit roll of 1. If the target of that attack does not have the IMPERIUM or CHAOS keywords, you can re-roll the Hit roll instead.",Imperium - Agents of the Imperium.cat
0b74-440c-ee1d-ca50:terminatus-assault:1fa0-c66e-a26a-0fc0,unit,0b74-440c-ee1d-ca50,Terminatus Assault,"Each time this unit ends a Charge move, each enemy unit within Engagement Range of this unit must take a Battle-shock test.",Imperium - Agents of the Imperium.cat
0b74-440c-ee1d-ca50:teleport-homer:2fdc-e0b9-3b6e-0181,unit,0b74-440c-ee1d-ca50,Teleport Homer,"At the start of the battle, you can set up one Teleport Homer token for this unit anywhere on the battlefield that is not in your opponent’s deployment zone. If you do, once per battle, you can target this unit with the Rapid Ingress Stratagem for 0CP, but when resolving that Stratagem, you must set this unit up within 3"" of that token and not within 9"" of any enemy models. That token is then removed.",Imperium - Agents of the Imperium.cat
0b74-440c-ee1d-ca50:invulnerable-save:5a4c-0f3b-2a04-f79c,unit,0b74-440c-ee1d-ca50,Invulnerable Save,Models in this unit have a 4+ invulnerable save.,Imperium - Agents of the Imperium.cat
0b74-440c-ee1d-ca50:attached-unit:b2e4-f556-18ce-413f,unit,0b74-440c-ee1d-ca50,Attached Unit,"If a CHARACTER from your army with the Leader ability can be attached to a DEATHWATCH KILL TEAM, it can be attached to this unit instead.",Imperium - Agents of the Imperium.cat
edce-f61c-8029-897f:fortis-doctrines:a864-3776-d243-adcd,unit,edce-f61c-8029-897f,Fortis Doctrines,"Each time a model in this unit makes an attack that targets a unit that is Below Half-strength, add 1 to the Hit roll.",Imperium - Agents of the Imperium.cat
edce-f61c-8029-897f:attached-unit:e9e3-81ec-087c-b8bf,unit,edce-f61c-8029-897f,Attached Unit,"If a CHARACTER from your army with the Leader ability can be attached to an DEATHWATCH KILL TEAM, it can be attached to this unit instead.",Imperium - Agents of the Imperium.cat
edce-f61c-8029-897f:transport:26bd-b08b-4012-387f,unit,edce-f61c-8029-897f,Transport,This unit cannot embark within an IMPERIAL RHINO.,Imperium - Agents of the Imperium.cat
c538-aaf0-5788-5c07:indomitor-doctrines:58e9-0f61-d97e-78ad,unit,c538-aaf0-5788-5c07,Indomitor Doctrines,"Each time a model in this unit makes an attack, add 1 to the Hit roll if this unit is below its Starting Strength, and add 1 to the Wound roll as well if this unit is Below Half-strength.",Imperium - Agents of the Imperium.cat
c538-aaf0-5788-5c07:attached-unit:50d2-fa59-670d-516a,unit,c538-aaf0-5788-5c07,Attached Unit,"If a CHARACTER unit from your army can be attached to a DEATHWATCH KILL TEAM, it can be attached to this unit instead.",Imperium - Agents of the Imperium.cat
c538-aaf0-5788-5c07:transport:b7ad-36cc-0a36-8992,unit,c538-aaf0-5788-5c07,Transport,This unit cannot embark within an IMPERIAL RHINO.,Imperium - Agents of the Imperium.cat
be4d-01bd-40a4-2299:jump-pack:362c-6893-6779-6259,unit,be4d-01bd-40a4-2299,Jump pack,"The bearer has a Move characteristic of 10"" and can move over models and terrain features as if they were not there.",Imperium - Agents of the Imperium.cat
3d93-287a-2b64-88ef:jump-pack:a6e3-3b6f-74e7-6077,unit,3d93-287a-2b64-88ef,Jump pack,"The bearer has a Move characteristic of 10"" and can move over models and terrain features as if they were not there.",Imperium - Agents of the Imperium.cat
88af-6e47-7162-b1be:catechism-of-death:209d-da09-990b-aacd,unit,88af-6e47-7162-b1be,Catechism of Death,"While this unit contains Chaplain Cassius, melee weapons equipped by models in this unit have the [DEVASTATING WOUNDS] ability.",Imperium - Agents of the Imperium.cat
88af-6e47-7162-b1be:unflinching:a629-8789-1049-a8b1,unit,88af-6e47-7162-b1be,Unflinching,You can re-roll Battle-shock tests for this unit.,Imperium - Agents of the Imperium.cat
63ec-4fea-e4a7-9509:invulnerable-save:6fdc-9df8-1c16-0403,unit,63ec-4fea-e4a7-9509,Invulnerable Save,Chaplain Cassius has a 4+ invulnerable save.,Imperium - Agents of the Imperium.cat
1f50-d117-0420-b3ab:jump-pack:592d-5ba3-6def-04bf,unit,1f50-d117-0420-b3ab,Jump Pack,"The bearer has a Move characteristic of 12"" and can move over models and terrain as if they were not there.",Imperium - Agents of the Imperium.cat
e774-67b3-9849-ce50:jump-pack:c95d-8383-2f1a-176d,unit,e774-67b3-9849-ce50,Jump Pack,"The bearer has a Move characteristic of 12"" and can move over models and terrain as if they were not there.",Imperium - Agents of the Imperium.cat
77b8-5555-5fbc-c219:psychic-hood:3672-ce89-5d2d-d000,unit,77b8-5555-5fbc-c219,Psychic Hood,Models in the bearer’s unit have the Feel No Pain 4+ ability against Psychic Attacks.,Imperium - Agents of the Imperium.cat
3665-0286-4cd7-bc33:invulnerable-save:8a7e-6c8f-8c92-099e,unit,3665-0286-4cd7-bc33,Invulnerable Save,Garran Branatar has a 4+ invulnerable save.,Imperium - Agents of the Imperium.cat
4681-2af4-acf9-2bce:proteus-doctrines:983b-3e69-e5a5-3ccd,unit,4681-2af4-acf9-2bce,Proteus Doctrines,"Each time a model in this unit makes an attack that targets a unit that is not Below Half-strength, add 1 to the Hit roll.",Imperium - Agents of the Imperium.cat
4681-2af4-acf9-2bce:attached-unit:d21b-63c6-4e69-7350,unit,4681-2af4-acf9-2bce,Attached Unit,"If a CHARACTER from your army with the Leader ability can be attached to a DEATHWATCH KILL TEAM, it can be attached to this unit instead.",Imperium - Agents of the Imperium.cat
7284-2777-4a6e-c62f:invulnerable-save:c4c6-c83c-856f-f298,unit,7284-2777-4a6e-c62f,Invulnerable Save,4+,Imperium - Agents of the Imperium.cat
da66-9d97-5ad4-2e2e:invulnerable-save:95b4-c0f6-c22e-c37f,unit,da66-9d97-5ad4-2e2e,Invulnerable Save,4+,Imperium - Agents of the Imperium.cat
a74e-0fb8-9c79-4881:jump-pack:0748-8435-1f34-5b57,unit,a74e-0fb8-9c79-4881,Jump Pack,"The bearer has a Move characteristic of 12"" and can move over models and terrain features as if they were not there.",Imperium - Agents of the Imperium.cat
f527-0a42-15b4-1924:attached-unit:cff0-bb50-0aa7-dc1f,unit,f527-0a42-15b4-1924,Attached Unit,"If a CHARACTER unit from your army can be attached to a DEATHWATCH KILL TEAM, it can be attached to this unit instead.",Imperium - Agents of the Imperium.cat
f527-0a42-15b4-1924:spectrus-doctrines:0dd1-84cf-f0b9-5f2f,unit,f527-0a42-15b4-1924,Spectrus Doctrines,"At the end of your opponent’s turn, if this unit is more than 6"" away from all enemy units, you can remove this unit from the battlefield and place it into Strategic Reserves. It will arrive back on the battlefield in the Reinforcements step of your next Movement phase.",Imperium - Agents of the Imperium.cat
f527-0a42-15b4-1924:transport:1d30-033e-3211-fc61,unit,f527-0a42-15b4-1924,Transport,This unit cannot embark within an IMPERIAL RHINO.,Imperium - Agents of the Imperium.cat
fd4a-2f76-771f-23b2:jump-pack:9ade-4a2b-d826-e42a,unit,fd4a-2f76-771f-23b2,Jump pack,"The bearer has a Move characteristic of 12"" and can move over models and terrain features as if they were not there.",Imperium - Agents of the Imperium.cat
50a9-30aa-e03a-847d:turbo-boost:85a2-03bc-8619-4c87,unit,50a9-30aa-e03a-847d,Turbo-boost,"Each time this unit Advances, do not make an Advance roll for it. Instead, until the end of the phase, add 6"" to the Move characteristic of models in this unit.",Imperium - Agents of the Imperium.cat
f158-1e0b-585b-bf40:invulnerable-save:73e1-18a4-7996-4f1d,unit,f158-1e0b-585b-bf40,Invulnerable Save,4+,Imperium - Agents of the Imperium.cat
f158-1e0b-585b-bf40:tactical-instinct:031c-1efa-dd80-b157,unit,f158-1e0b-585b-bf40,Tactical Instinct,"While this model is leading a unit, weapons equipped by models in that unit have the [LETHAL HITS] ability.",Imperium - Agents of the Imperium.cat
f158-1e0b-585b-bf40:unstoppable-champion:cb52-8ace-307f-c163,unit,f158-1e0b-585b-bf40,Unstoppable Champion,"The first time this model is destroyed, roll one D6 at the end of the phase. On a 2+, set this model back up on the battlefield, as close as possible to where it was destroyed and not within Engagement Range of any enemy units, with 1 wound remaining.",Imperium - Agents of the Imperium.cat
f158-1e0b-585b-bf40:leader:d5b5-ce50-fdad-3a41,unit,f158-1e0b-585b-bf40,Leader,This model can be attached to the following units: DEATHWATCH KILL TEAM,Imperium - Agents of the Imperium.cat
cfa5-df26-a886-9975:invulnerable-save:5e5b-1e4f-b228-863d,unit,cfa5-df26-a886-9975,Invulnerable Save,This model has a 4+ invulnerable save.,Imperium - Agents of the Imperium.cat
cfa5-df26-a886-9975:strategic-knowledge:bb75-0aef-e9ae-3fb6,unit,cfa5-df26-a886-9975,Strategic Knowledge,"While this model is leading a unit, that unit is eligible to shoot and declare a charge in a turn in which it Advanced or Fell Back.",Imperium - Agents of the Imperium.cat
cfa5-df26-a886-9975:rites-of-battle:08a0-d7b9-c806-9a9c,unit,cfa5-df26-a886-9975,Rites of Battle,"Once per battle round, one unit from your army with this ability can use it when its unit is targeted with a Stratagem. If it does, reduce the CP cost of that use of that Stratagem by 1CP.",Imperium - Agents of the Imperium.cat
cfa5-df26-a886-9975:leader:ef77-98ab-f3f6-87d3,unit,cfa5-df26-a886-9975,Leader,This model can be attached to the following units: DEATHWATCH KILL TEAM,Imperium - Agents of the Imperium.cat
4e74-3710-7a66-9d6c:ministorum-sermon:076f-bb1f-48be-9b3d,unit,4e74-3710-7a66-9d6c,Ministorum Sermon,"While this unit contains a **^^Ministorum Priest**^^, each time a model in this unit makes a melee attack, add 1 to the Wound roll.",Imperium - Agents of the Imperium.cat
4e74-3710-7a66-9d6c:cherub:68be-e62c-f245-c857,unit,4e74-3710-7a66-9d6c,Cherub,"Once per battle, you can target this unit with the Command Re-roll Stratagem for 0CP, and can do so even if you have already targeted a different unit with that Stratagem this phase.",Imperium - Agents of the Imperium.cat
4e74-3710-7a66-9d6c:attached-unit:154c-dd68-8c6f-2483,unit,4e74-3710-7a66-9d6c,Attached Unit,"If a ^^**Ministorum Priest^^** or ^^**Inquisitor^^** model from your army with the Leader ability can be attached to a ^^**Sisters of Battle Squad^^**, it can be attached to this unit instead. If a ^^**Ministorum Priest^^** or ^^**Inquisitor^^** model from your army is attached to this unit during the Declare Battle Formations step, that model gains the Scouts 6"" ability.",Imperium - Agents of the Imperium.cat
4e74-3710-7a66-9d6c:invulnerable-save:fac5-290c-cddc-d4f3,unit,4e74-3710-7a66-9d6c,Invulnerable Save,Models in this unit have a 5+ invulnerable save.,Imperium - Agents of the Imperium.cat
6315-d3e6-aa1c-69e4:ward-against-the-malefic-arts:0aad-6917-8a35-facb,unit,6315-d3e6-aa1c-69e4,Ward Against the Malefic Arts,"While this unit is leading a unit, each time a Psychic Attack targets that unit, subtract 1 from the Hit roll and subtract 1 from the Wound roll.",Imperium - Agents of the Imperium.cat
6315-d3e6-aa1c-69e4:vox‑cast-proclamations-(aura):a0bb-2f75-d3f5-d444,unit,6315-d3e6-aa1c-69e4,Vox‑cast Proclamations (Aura),"Each time your opponent targets a unit from their army with a Stratagem, if that unit is within 12"" of this unit’s Inquisitor Ostromandeus model, increase the cost of that use of that Stratagem by 1CP.",Imperium - Agents of the Imperium.cat
6315-d3e6-aa1c-69e4:leader:7e6d-78d9-dd86-7270,unit,6315-d3e6-aa1c-69e4,Leader,"This model can be attached to the following units: EXACTION SQUAD, IMPERIUM BATTLELINE INFANTRY, IMPERIAL NAVY BREACHERS, INQUISITORIAL AGENTS, SISTERS OF BATTLE SQUAD, SUBDUCTOR SQUAD, VIGILANT SQUAD",Imperium - Agents of the Imperium.cat
4902-9ea0-c1fc-164c:invulnerable-save:8bd0-37c4-23a5-fe8a,unit,4902-9ea0-c1fc-164c,Invulnerable Save,This unit's Inquisitor Ostromandeus model has a 5+ invulnerable save.,Imperium - Agents of the Imperium.cat
b040-ce24-7e1a-c903:death-to-the-alien:7049-403f-9c3d-c2cd,unit,b040-ce24-7e1a-c903,Death to the Alien,"Each time a model in this unit makes an attack, re-roll a Hit roll of 1. If the target of that attack does not have the ^^**Imperium^^** or ^^**Chaos^^** keywords, you can re-roll the Hit roll instead.",Imperium - Agents of the Imperium.cat
b040-ce24-7e1a-c903:attached-unit:f3c2-d90e-028f-d356,unit,b040-ce24-7e1a-c903,Attached Unit,"If a ^^**Character^^** unit from your army can be attached to a ^^**Deathwatch Kill Team^^** unit, it can be attached to this unit instead.",Imperium - Agents of the Imperium.cat
90e0-c5a9-17c5-fba4:invulnerable-save-(5+):077c-7ace-120a-7e39,unit,90e0-c5a9-17c5-fba4,Invulnerable Save (5+),This model has a 5+ invulnerable save.,Imperium - Agents of the Imperium.cat
90e0-c5a9-17c5-fba4:moment-of-glory:e97c-a4cc-83c5-5a60,unit,90e0-c5a9-17c5-fba4,Moment of Glory,"Once per battle, in the Fight phase, this model can use this ability. If it does, until the end of the phase, improve the Strength and Attacks characteristics of melee weapons equipped by this model by 3.",Imperium - Agents of the Imperium.cat
90e0-c5a9-17c5-fba4:high-handed-authority:8574-0af7-a693-a12f,unit,90e0-c5a9-17c5-fba4,High-handed Authority,"While this model is leading a unit, it can embark within any ^^**Transport**^^ that its Bodyguard unit can embark within.",Imperium - Agents of the Imperium.cat
9a75-f3a2-bff5-9f08:invulnerable-save-(4+):cd37-9367-9708-017c,unit,9a75-f3a2-bff5-9f08,Invulnerable Save (4+),This model has a 4+ invulnerable save.,Imperium - Agents of the Imperium.cat
9a75-f3a2-bff5-9f08:your-vigil-is-not-yet-ended:609c-9739-e398-121c,unit,9a75-f3a2-bff5-9f08,Your Vigil is Not Yet Ended,"While this model is leading a unit, in your Command phase, you can returned 1 destroyed model (excluding ^^**Character**^^ models) to that unit.",Imperium - Agents of the Imperium.cat
9a75-f3a2-bff5-9f08:leader:18c7-6e45-7c8b-ddbd,unit,9a75-f3a2-bff5-9f08,Leader,This model can be attached to the following unit: ^^**Deathwatch Kill Team^^**,Imperium - Agents of the Imperium.cat
9a75-f3a2-bff5-9f08:high-handed-authority:08cb-7d53-57ec-4f2e,unit,9a75-f3a2-bff5-9f08,High-handed Authority,"While this model is leading a unit, it can embark within any ^^**Transport**^^ that its Bodyguard unit can embark within.",Imperium - Agents of the Imperium.cat
2b47-b5e8-b297-7bd8:invulnerable-save-(4+):5a80-b865-3294-d97d,unit,2b47-b5e8-b297-7bd8,Invulnerable Save (4+),This model has a 4+ invulnerable save.,Imperium - Agents of the Imperium.cat
2b47-b5e8-b297-7bd8:towering-reputation-(aura):bfdd-ffaa-bc5c-1c6e,unit,2b47-b5e8-b297-7bd8,Towering Reputation (Aura),"While a friendly unit is within 6"" of this model, improve the Leadership characteristic of models in that unit by 1. While an enemy unit is within 6"" of this model, worsen the Leadership characteristic of models in that unit by 1.",Imperium - Agents of the Imperium.cat
2b47-b5e8-b297-7bd8:high-handed-authority:c08f-b2ef-7c26-6bf4,unit,2b47-b5e8-b297-7bd8,High-handed Authority,"While this model is leading a unit, it can embark within any ^^**Transport**^^ that its Bodyguard unit can embark within.",Imperium - Agents of the Imperium.cat
cb99-456-f100-40ed:emplacement-platform:2a04-449d-87ed-e7b4,unit,cb99-456-f100-40ed,Emplacement Platform,Friendly **^^Astra Militarum Infantry**^^ models can be set up or end any type of move on top of the platform section of this **^^Fortification^^**.,Imperium - Astra Militarum - Library.cat
cb99-456-f100-40ed:reinforced-cover:a11b-d88f-224b-7bd7,unit,cb99-456-f100-40ed,Reinforced Cover,"Each time a ranged attack is allocated to a model, if that model is not fully visible to every model in the attacking unit because of this **^^Fortification^^**, that model has the Benefit of Cover against that attack.",Imperium - Astra Militarum - Library.cat
cb99-456-f100-40ed:defence-line:6d15-ae73-bc60-165b,unit,cb99-456-f100-40ed,Defence Line,"While an **^^Astra Militarum Infantry^^** model has the Benefit of Cover as a result of this terrain feature, that model has a 4+ invulnerable save",Imperium - Astra Militarum - Library.cat
cb99-456-f100-40ed:deployment:c620-2ef7-d09d-1ed3,unit,cb99-456-f100-40ed,Deployment,"When this model is set up, it will consist of 1 platform section, up to 5 shield sections, up to 2 broken shield sections and up to 2 end sections. All sections must be connected to each other to form a continuous defence line; the 2 broken shield sections can be placed either at the end of the defence line, or in the middle of it such that both are within ½"" of each other (in this case, these 2 sections count as being connected to each other). All of the sections that have been set up are then treated as a single model for all rules purposes.",Imperium - Astra Militarum - Library.cat
7e34-20cf-1149-74a1:mobile-hunter-killers:a8e5-75ce-78-c222,unit,7e34-20cf-1149-74a1,Mobile Hunter-killers,"Each time a model in this unit makes an attack that targets a **^^Monster^^** or **^^Vehicle^^** unit, you can re-roll the Wound roll.",Imperium - Astra Militarum - Library.cat
a6a1-1612-f982-31:rolling-fortress:428-ed57-e316-6110,unit,a6a1-1612-f982-31,Rolling Fortress,"Each time a ranged attack is allocated to an **^^Astra Militarum^^** model from your army, if that model is not fully visible to every model in the attacking unit because of this **^^Baneblade^^** model, that model has the Benefit of Cover against that attack.",Imperium - Astra Militarum - Library.cat
d10-48db-3241-ec72:tremor-quake:9d96-e786-c41e-8164,unit,d10-48db-3241-ec72,Tremor Quake,"In your Shooting phase, just after selecting a target for this model’s tremor cannon, the target unit and every other enemy **^^Infantry^^** unit within 3"" of that unit must take a Battle-shock test.",Imperium - Astra Militarum - Library.cat
d10-48db-3241-ec72:transport:3ee3-a15-ade4-596b,unit,d10-48db-3241-ec72,Transport,This model has a transport capacity of 26 **^^Astra Militarum Infantry models^^**. Each **^^Ogryn^^** model takes up the space of 3 models. It cannot transport **^^Artillery^^** models.,Imperium - Astra Militarum - Library.cat
30f5-d90a-9811-d763:armour-obliteration:9488-79da-f341-5163,unit,30f5-d90a-9811-d763,Armour Obliteration,"Each time an attack made with this model’s quake cannon destroys an enemy model that has the Deadly Demise ability, that model’s Deadly Demise ability inflicts mortal wounds on a D6 roll of 3+ instead of on a 6.",Imperium - Astra Militarum - Library.cat
bf53-4ab3-ff75-9aa0:earthshaker-rounds:883c-f9b4-c57c-b535,unit,bf53-4ab3-ff75-9aa0,Earthshaker Rounds,"In your Shooting phase, after this model has shot, if one or more of those attacks made with its earthshaker cannon scored a hit against an enemy **^^Infantry^^** unit, until the start of your next Shooting phase, that unit is shaken. While a unit is shaken, subtract 2"" from its Move characteristic and subtract 2 from Charge rolls made for it.",Imperium - Astra Militarum - Library.cat
2b49-4d03-aaf5-3532:senior-officer:a7f5-adb8-d1c9-2a2d,unit,2b49-4d03-aaf5-3532,Senior Officer,"While this model is leading a unit, ranged weapons equipped by models in that unit have the **[SUSTAINED HITS 1]** ability",Imperium - Astra Militarum - Library.cat
2b49-4d03-aaf5-3532:get-back-in-the-fight:cd15-5c13-fa1e-b2eb,unit,2b49-4d03-aaf5-3532,Get Back in the Fight,"While this model is leading a unit, that unit is eligible to shoot in a turn in which it Fell Back.",Imperium - Astra Militarum - Library.cat
4d28-f2a7-67c1-eb2e:cadia-stands!:4248-cf6f-79c7-aba6,unit,4d28-f2a7-67c1-eb2e,Cadia Stands!,"While this unit contains an **^^Officer^^**, each time a ranged attack targets this unit, if this unit is within range of an objective marker you control, models in this unit have the Benefit of Cover against that attack.",Imperium - Astra Militarum - Library.cat
cf23-58db-8ba4-9ec8:mobile-command-vehicle:892a-b5c8-8a39-46bd,unit,cf23-58db-8ba4-9ec8,Mobile Command Vehicle,"In your Command phase, one **^^Officer^^** model embarked within this **^^Transport^^** can issue Orders even though it is not on the battlefield. When doing so, measure distances to and from this *^^Transport^^**.",Imperium - Astra Militarum - Library.cat
