ability_id,source_type,source_id,name,text,source_file
f62a-bea1-a015-3668:transport:5a0a-5557-a36a-1a3d,unit,f62a-bea1-a015-3668,Transport,"This model has a transport capacity of 12 Adeptus Astartes Infantry models. Each Jump Pack, Wulfen, Gravis or Terminator model takes up the space of 2 models and each Centurion model takes up the space of 3 models.",Imperium - Space Marines.cat
525c-7e0-b0de-8a6f:mortis-strike:85b6-dc61-b59d-2e99,unit,525c-7e0-b0de-8a6f,Mortis Strike,"Each time this model makes a ranged attack that targets a unit that is not Below Half-strength, you can re-roll the Hit roll.",Imperium - Space Marines.cat
534d-4e94-5a8a-75ae:armoured-spearhead:f7df-e297-d554-8c37,unit,534d-4e94-5a8a-75ae,Armoured Spearhead,"Each time this model makes an attack that targets an enemy unit, re-roll a Hit roll of 1 and, if that unit is within range of an objective marker you do not control, you can re-roll the Hit roll instead.",Imperium - Space Marines.cat
b51-a07d-6440-e1ad:invulnerable-save:f7d3-5636-5e66-ccbf,unit,b51-a07d-6440-e1ad,Invulnerable Save,5+,Imperium - Space Marines.cat
d4ad-4638-c7a7-1af6:isolate-and-destroy:ae6f-18f-928c-3862,unit,d4ad-4638-c7a7-1af6,Isolate and Destroy,"Each time this model makes an attack that targets an enemy unit, if there are no other units from your opponent’s army within 6"" of that target, add 1 to the Wound roll.",Imperium - Space Marines.cat
103c-8f97-ed61-1922:invulnerable-save:dcc-4574-85fe-3175,unit,103c-8f97-ed61-1922,Invulnerable Save,5+,Imperium - Space Marines.cat
103c-8f97-ed61-1922:death-hold:531c-aeb5-cc4e-10af,unit,103c-8f97-ed61-1922,Death-hold,"When making ranged attacks, this model does not suffer the penalty to its Hit rolls for being within Engagement Range of one or more enemy units.",Imperium - Space Marines.cat
df9b-111-d64a-e298:transport:6943-fbd0-f8ec-a693,unit,df9b-111-d64a-e298,Transport,"This model has a transport capacity of 12 Adeptus Astartes Infantry models. Each Jump Pack, Wulfen, Gravis or Terminator model takes up the space of 2 models and each Centurion model takes up the space of 3 models.",Imperium - Space Marines.cat
df9b-111-d64a-e298:into-the-foe:58cc-7fec-e711-e00d,unit,df9b-111-d64a-e298,Into the Foe,"If a unit disembarks from this Transport before it moves, until the end of the turn, that unit is eligible to charge in a turn in which it Advanced.",Imperium - Space Marines.cat
bbc6-900e-c5f2-d634:assault-ramp:af2f-1276-517a-7530,unit,bbc6-900e-c5f2-d634,Assault Ramp,"Each time a unit disembarks from this model after it has made a Normal move, that unit is still eligible to declare a charge this turn.",Imperium - Space Marines.cat
bbc6-900e-c5f2-d634:transport:a364-2ddf-6bdc-49a3,unit,bbc6-900e-c5f2-d634,Transport,"This model has a transport capacity of 12 Adeptus Astartes Infantry models. Each Jump Pack, Wulfen, Gravis or Terminator model takes up the space of 2 models and each Centurion model takes up the space of 3 models.",Imperium - Space Marines.cat
60cb-cc1-c820-86f5:wisdom-of-the-ancients-[aura]:91b2-168c-541c-2b36,unit,60cb-cc1-c820-86f5,Wisdom of the Ancients [Aura],"While a friendly Adeptus Astartes Infantry unit is within 6"" of this model, each time a model in that unit makes an attack, re-roll a Hit roll of 1.",Imperium - Space Marines.cat
80d1-496f-40fd-c154:self-repair:2d52-9311-c419-9fba,unit,80d1-496f-40fd-c154,Self Repair,"At the end of your Command phase, this model regains 1 lost wound.",Imperium - Space Marines.cat
80d1-496f-40fd-c154:transport:b3e8-3ffa-5e58-9409,unit,80d1-496f-40fd-c154,Transport,"This model has a transport capacity of 6 Adeptus Astartes Infantry models. It cannot transport Jump Pack, Wulfen, Phobos, Gravis, Centurion, Terminator or Tacticus models (except for Tacticus Character models that begin the battle attached to a non-Tacticus unit).",Imperium - Space Marines.cat
80d1-496f-40fd-c154:orbital-comms-array-[aura]:3cbb-ae43-5a83-14a7,unit,80d1-496f-40fd-c154,Orbital Comms Array [Aura],"While a friendly Adeptus Astartes unit is within 6"" of the bearer, each time you target that unit with a Stratagem, roll one D6: on a 5+, you gain 1CP",Imperium - Space Marines.cat
c8e1-69a5-1121-6f79:assault-ramp:c73b-5548-ab0c-c9b1,unit,c8e1-69a5-1121-6f79,Assault Ramp,"Each time a unit disembarks from this model after it has made a Normal move, that unit is still eligible to declare a charge this turn.",Imperium - Space Marines.cat
c8e1-69a5-1121-6f79:transport:5bb8-2a39-d78f-3f9,unit,c8e1-69a5-1121-6f79,Transport,"This model has a transport capacity of 12 Adeptus Astartes Infantry models. Each Jump Pack, Wulfen, Gravis or Terminator model takes up the space of 2 models and each Centurion model takes up the space of 3 models.",Imperium - Space Marines.cat
c8e1-69a5-1121-6f79:invulnerable-save:a9fd-570f-7615-665,unit,c8e1-69a5-1121-6f79,Invulnerable Save,5+,Imperium - Space Marines.cat
faa-3b84-1365-9c22:swift-assault:86aa-bb8d-2ab7-9a1a,unit,faa-3b84-1365-9c22,Swift Assault,"While this model is leading a unit, ranged weapons equipped by models in that unit have the [ASSAULT] ability.",Imperium - Space Marines.cat
faa-3b84-1365-9c22:unbreakable-duty:9cee-b567-8106-880a,unit,faa-3b84-1365-9c22,Unbreakable Duty,"While this model is within range of an objective marker and/or within 6"" of the centre of the battlefield, this model has the Feel No Pain 4+ ability.",Imperium - Space Marines.cat
faa-3b84-1365-9c22:leader:893c-22fb-ecd5-1968,unit,faa-3b84-1365-9c22,Leader,"This model can be attached to the following units:

■ Assault Squad
■ Command Squad
■ Tactical Squad
■ Vanguard Veteran Squad
■ Devastator Squad

You can attach this model to one of the above units even if one Character model has already been attached to it. If you do, and that Bodyguard unit is destroyed, the Leader units attached to it become separate units, with their original Starting Strengths.",Imperium - Space Marines.cat
d4c6-55c1-e552-9f6c:assault-ramp:562a-7fc-f1a6-cc9a,unit,d4c6-55c1-e552-9f6c,Assault Ramp,"Each time a unit disembarks from this model after it has made a Normal move, that unit is still eligible to declare a charge this turn.",Imperium - Space Marines.cat
2a4c-d1a-95c9-f4cf:fire-support:8be5-e098-4bae-3dff,unit,2a4c-d1a-95c9-f4cf,Fire Support,"In your Shooting phase, after this model has  shot, select one enemy unit it scored one or more hits against this phase. Until the end of the phase, each time a friendly model that disembarked from this Transport this turn makes an attack that targets that enemy unit, you can re-roll the Wound roll.",Imperium - Space Marines.cat
2a4c-d1a-95c9-f4cf:transport:2ce6-800-5168-f130,unit,2a4c-d1a-95c9-f4cf,Transport,"This model has a transport capacity of 6 Adeptus Astartes Infantry models. It cannot transport Jump Pack, Wulfen, Tacticus, Phobos, Gravis, Centurion or Terminator models.",Imperium - Space Marines.cat
a40-ff3f-c1ea-fea7:vanguard-assault:3fe6-df5a-9e71-acd9,unit,a40-ff3f-c1ea-fea7,Vanguard Assault,"Each time this unit ends a Charge move, until the end of the turn, melee weapons equipped by models in this unit have the [LETHAL HITS] ability.",Imperium - Space Marines.cat
97c3-20c8-4c99-39e5:martial-superiority:c2c3-9cc1-cd16-2de9,unit,97c3-20c8-4c99-39e5,Martial Superiority,"Each time this model makes a melee attack that targets a Character unit, you can re-roll the Hit roll and you can re-roll the Wound roll",Imperium - Space Marines.cat
97c3-20c8-4c99-39e5:honour-or-death:4bf1-1eae-236a-4d4,unit,97c3-20c8-4c99-39e5,Honour or Death,"While this model is leading a unit, add 1 to Advance and Charge rolls made for that unit and you can target that unit with the Heroic Intervention  stratagem for 0CP, even if you have already used that Stratagem on a different unit this phase.",Imperium - Space Marines.cat
97c3-20c8-4c99-39e5:leader:1150-328f-66f5-11fd,unit,97c3-20c8-4c99-39e5,Leader,"This model can be attached to the following units:

■ Bike Squad
■ Outrider Squad",Imperium - Space Marines.cat
e4c7-b10c-6896-3f0:leader:bb08-858e-9634-9515,unit,e4c7-b10c-6896-3f0,Leader,"This model can be attached to the following units:

■ Bike Squad
■ Outrider Squad",Imperium - Space Marines.cat
e4c7-b10c-6896-3f0:unbreakable-duty:57ab-cc79-bce4-f9ff,unit,e4c7-b10c-6896-3f0,Unbreakable Duty,"While this model is within range of an objective marker and/or within 6"" of the centre of the battlefield, this model has the Feel No Pain 4+ ability.",Imperium - Space Marines.cat
449f-a74d-e85a-2684:leader:e17-41e5-b31-1d44,unit,449f-a74d-e85a-2684,Leader,"This model can be attached to the following units:

■ Bike Squad
■ Outrider Squad",Imperium - Space Marines.cat
449f-a74d-e85a-2684:gene-seed-recovery:64b0-83c0-a1db-1ee8,unit,449f-a74d-e85a-2684,Gene Seed Recovery,"When this model’s Bodyguard unit is destroyed, roll one D6: on a 2+, you gain 1CP.",Imperium - Space Marines.cat
449f-a74d-e85a-2684:narthecium:7782-ca5-3b11-d45d,unit,449f-a74d-e85a-2684,Narthecium,"While this model is leading a unit, in your Command phase, you can return 1 destroyed model (excluding Character models) to that unit.",Imperium - Space Marines.cat
33e2-3ddf-7063-df9e:blessing-of-the-omnissiah:4a3f-c7c6-c5ed-92eb,unit,33e2-3ddf-7063-df9e,Blessing of the Omnissiah,"In your Command phase, you can select one friendly Adeptus Astartes Vehicle model within 3"" of this model. That model regains up to D3 lost wounds and, until the start of your next Command phase, each time that Vehicle model makes an attack, add 1 to the Hit roll. Each model can only be selected for this ability once per turn.",Imperium - Space Marines.cat
33e2-3ddf-7063-df9e:leader:3d8f-6029-fdb9-6f40,unit,33e2-3ddf-7063-df9e,Leader,"This model can be attached to the following units:

■ Bike Squad
■ Outrider Squad",Imperium - Space Marines.cat
33e2-3ddf-7063-df9e:techmarine:4a65-f686-e774-6019,unit,33e2-3ddf-7063-df9e,Techmarine,"While this model is within 3"" of one or more friendly Adeptus Astartes Vehicle units, this model has the Lone Operative ability",Imperium - Space Marines.cat
33e2-3ddf-7063-df9e:vengeance-of-the-omnissiah:a064-20c3-371a-261f,unit,33e2-3ddf-7063-df9e,Vengeance of the Omnissiah,"If a friendly Adeptus Astartes Vehicle model is destroyed within 12"" of this model, until the end of the battle, this model’s Omnissian power axe has an
Attacks characteristic of 7.",Imperium - Space Marines.cat
1039-4a94-c791-9e1d:leader:292a-c073-f9f3-3e45,unit,1039-4a94-c791-9e1d,Leader,"This model can be attached to the following units:

■ Bike Squad
■ Outrider Squad",Imperium - Space Marines.cat
1039-4a94-c791-9e1d:mental-fortress:35b7-41e1-1488-6df9,unit,1039-4a94-c791-9e1d,Mental Fortress,"While this model is leading a unit, models in that unit have a 4+ invulnerable save.",Imperium - Space Marines.cat
1051-f1e8-4ef2-4575:damaged:-1-10-wounds-remaining:81de-26d4-5418-74c1,unit,1051-f1e8-4ef2-4575,Damaged: 1-10 wounds remaining,"While this model has 1-10 wounds remaining, each time this model makes an attack, subtract 1 from the Hit roll.",Imperium - Space Marines.cat
1051-f1e8-4ef2-4575:transport:b6ef-f95b-5e81-4cac,unit,1051-f1e8-4ef2-4575,Transport,"This model has a transport capacity of 15 Adeptus Astartes Infantry or Adeptus Astartes Mounted models. Each Jump Pack, Wulfen, Gravis or Terminator model takes up the space of 2 models. Each Centurion model takes up the space of 3 models. Each Mounted model takes up the space of 4 models. This model can also transport up to 2 Adeptus Astartes Vehicle models (excluding Aircraft and Titanic models). Models embarked within Transport Vehicles that are themselves being transported by this model do not count towards the transport capacity of this model.",Imperium - Space Marines.cat
1051-f1e8-4ef2-4575:aerial-deployment:a516-5f1f-4d3e-3e3c,unit,1051-f1e8-4ef2-4575,Aerial Deployment,"If this model starts the game in Hover mode and in Strategic Reserves, it can be set up in the Reinforcements step of your first, second or third Movement phase, regardless of any mission rules.",Imperium - Space Marines.cat
6a7a-9078-8af1-c02e:sentry-programming:cc0f-6f78-2f0b-1002,unit,6a7a-9078-8af1-c02e,Sentry Programming,"You can target this model with the Fire Overwatch Stratagem for 0CP, and can do so even if you have already targeted a different unit with that Stratagem this turn.  This model can only be targeted with that Stratagem once
per turn.",Imperium - Space Marines.cat
cdd9-efda-95-e7b2:hammer-of-wrath:1df-b883-26cb-3084,unit,cdd9-efda-95-e7b2,Hammer of Wrath,"Each time this unit ends a Charge move, select one enemy unit within Engagement Range of it, then roll one D6 for each model in this unit that is within Engagement Range of that enemy unit: for each 4+, that enemy unit suffers 1 mortal wound.",Imperium - Space Marines.cat
2f2e-d99b-b235-163a:ancient-banner:9ced-4a20-1c04-203d,unit,2f2e-d99b-b235-163a,Ancient Banner,"While this unit contains an Ancient, add 1 to the Objective Control characteristic of models in this unit",Imperium - Space Marines.cat
2f2e-d99b-b235-163a:command-squad:cb97-8ee0-1cbf-e38f,unit,2f2e-d99b-b235-163a,Command Squad,"While a Character model is leading this unit, each time an attack targets this unit, subtract 1 from the Wound roll.",Imperium - Space Marines.cat
2f2e-d99b-b235-163a:company-heroes:8a9-4b06-b80-76df,unit,2f2e-d99b-b235-163a,Company Heroes,"You must attach one Captain or Chapter Master model to this unit. If this is not possible, this unit does not take part in the battle and counts as having been destroyed.",Imperium - Space Marines.cat
dc83-f2ef-802a-5662:leader:1ac6-dae7-e792-f5ab,unit,dc83-f2ef-802a-5662,Leader,"This model can be attached to the following units:

■ Assault Intercessor Squad
■ Bladeguard Veteran Squad
■ Company Heroes
■ Hellblaster Squad
■ Infernus Squad
■ Intercessor Squad
■ Sternguard Veteran Squad
■ Tactical Squad",Imperium - Space Marines.cat
dc83-f2ef-802a-5662:master-of-rites:6083-9867-cacf-eb8a,unit,dc83-f2ef-802a-5662,Master of Rites,"In your Command phase, select one of the following to apply to this model’s unit until the end of the turn: 


■ This model’s unit is eligible to shoot in a turn in which it Advanced.


■ This model’s unit is eligible to declare a charge in a turn in it which it Advanced.


■ This model’s unit is eligible to shoot and declare a charge in a turn in which it Fell Back.",Imperium - Space Marines.cat
dc83-f2ef-802a-5662:unrelenting-and-uncompromising:53b4-562f-b888-7e28,unit,dc83-f2ef-802a-5662,Unrelenting and Uncompromising,"While this model is leading a unit, each time a model in that unit makes an attack, you can ignore any or all modifiers to that attack’s Ballistic Skill or Weapon Skill characteristics and/or all modifiers to
the Hit roll.",Imperium - Space Marines.cat
74ba-6762-ef01-32d6:exemplar-warrior:7cb2-5e51-6a7a-a8e8,unit,74ba-6762-ef01-32d6,Exemplar Warrior,"Once per turn, when this model's unit is selected to shoot or fight, it can use this ability. If it does, until the end of the phase, each time this model makes an attack, you can re-roll the Wound Roll.",Imperium - Space Marines.cat
74ba-6762-ef01-32d6:leader:f765-5335-b701-5af3,unit,74ba-6762-ef01-32d6,Leader,"This model can be attached to the following units:
- **^^Tacticus^^** (Excluding ^^**Character^^** and **^^Fly**^^)
- **^^Tactical Squad^^**",Imperium - Space Marines.cat
0385-0e03-0eac-d91c:veil-of-time-(psychic):d60e-18e8-35b8-4464,unit,0385-0e03-0eac-d91c,Veil of Time (Psychic),Weapons equipped by models in this unit have the [Sustained Hits 1] ability,Imperium - Space Marines.cat
0385-0e03-0eac-d91c:leader:4967-4658-e38c-166b,unit,0385-0e03-0eac-d91c,Leader,"This model can be attached to the following units:
- **^^Tacticus^^** (Excluding ^^**Character^^** and **^^Fly**^^)
- **^^Tactical Squad^^**",Imperium - Space Marines.cat
3fe2-9d72-8251-adb4:wisdom-of-the-ancients-[aura]:58a3-0194-214d-47da,unit,3fe2-9d72-8251-adb4,Wisdom of the Ancients [Aura],"When a friendly ^^**Adeptus Astartes Infantry**^^ unit is within 6"" of this model, each time a model in that unit makes an attack, re-roll a Hit roll of 1",Imperium - Space Marines.cat
c65-46c6-3a62-80c:leader:a4fa-4c44-e872-45e4,unit,c65-46c6-3a62-80c,Leader,"This model can be attached to the following units:

■ Wolf Guard Terminators",Imperium - Space Wolves.cat
c65-46c6-3a62-80c:high-king-of-fenris:d440-cfb4-0569-b40f,unit,c65-46c6-3a62-80c,High King of Fenris,"Once per battle round, in your Movement phase, you can select one friendly Space Wolves unit that is in Reserves. If you do, until the end of the phase, for the purposes of setting up that unit on the battlefield, treat the current battle round number as being one higher than it actually is.",Imperium - Space Wolves.cat
c65-46c6-3a62-80c:guile-of-the-wolf-(aura):da55-1594-5d76-2ada,unit,c65-46c6-3a62-80c,Guile of the Wolf (Aura),"Each time your opponent targets a unit from their army with a Stratagem, if that unit is within 12"" of this model, increase the cost of that usage of that Stratagem by 1CP P (this is not cumulative with any other rules that increase the CP cost of that Stratagem)",Imperium - Space Wolves.cat
c65-46c6-3a62-80c:embarking-within-transports:f707-93b3-60bb-5d7a,unit,c65-46c6-3a62-80c,Embarking within Transports,"This model can embark within friendly Adeptus Astartes Transport models that can transport Terminator models. When doing, it takes up the space of 4 Infantry models",Imperium - Space Wolves.cat
54e3-9fb6-416-8a90:leader:bac4-1b4c-7726-15d3,unit,54e3-9fb6-416-8a90,Leader,"This model can be attached to the following unit:

■ Thunderwolf Cavalry",Imperium - Space Wolves.cat
54e3-9fb6-416-8a90:logan-grimnar:4637-2fb1-ef9a-7704,unit,54e3-9fb6-416-8a90,Logan Grimnar,Your army cannot contain both Logan Grimnar and Logan Grimnar on Stormrider,Imperium - Space Wolves.cat
bd47-a00a-e70-abd6:leader:ca3b-fa42-d47f-d218,unit,bd47-a00a-e70-abd6,Leader,"This model can be attached to the following units:

■ Blood Claws
■ Grey Hunters
■ Wolf Guard Headtakers",Imperium - Space Wolves.cat
bd47-a00a-e70-abd6:wind-walker-(psychic):7c09-4906-3ef8-5839,unit,bd47-a00a-e70-abd6,Wind Walker (Psychic),"While this model is leading a unit, ranged weapons equipped by models in that unit have the [ASSAULT] ability and each time that unit advances, do not make an Advance roll. Instead, until the end of the phase, add 6"" to the Move characteristic of models in this unit",Imperium - Space Wolves.cat
bd47-a00a-e70-abd6:tempest's-wrath-(psychic):4f53-4232-cc6a-b8e3,unit,bd47-a00a-e70-abd6,Tempest's Wrath (Psychic),"In your Shooting phase, after this model's unit has shot, select one enemy unit, (excluding MONSTERS and VEHICLES) hit by one or more of those attacks made with this model's Living Lightning weapon. Until the start of your next turn, that enemy is stormwracked. While a unit is stormwracked, subtract 6"" from the Range characteristic of ranged weapons equipped by models in that unit (to a minimum of 12"")",Imperium - Space Wolves.cat
c35a-6d78-2169-3d23:legendary-tenacity:1ecf-416a-6465-156c,unit,c35a-6d78-2169-3d23,Legendary Tenacity,"Each time an attack is allocated to this model, if the Strength characteristic of that attack is greater than this model's Toughness characteristic, subtract 1 from the Wound roll.",Imperium - Space Wolves.cat
c35a-6d78-2169-3d23:ancient-tactician:64d9-5889-14e6-77a1,unit,c35a-6d78-2169-3d23,Ancient Tactician,"At the start of your Command phase, if this model is on the battlefield, you gain 1 CP",Imperium - Space Wolves.cat
c35a-6d78-2169-3d23:invulnerable-save:954b-8a3c-4631-01fb,unit,c35a-6d78-2169-3d23,Invulnerable Save,5+,Imperium - Space Wolves.cat
a9c8-1a6-a0e1-7698:leader:8970-5680-4afc-a67d,unit,a9c8-1a6-a0e1-7698,Leader,"This model can be attached to the following units:

■ Wolf Guard Terminators",Imperium - Space Wolves.cat
a9c8-1a6-a0e1-7698:anvil-of-endurance:6d1-52cc-8cb0-740c,unit,a9c8-1a6-a0e1-7698,Anvil of Endurance,"While this model is leading a unit, each time a model in that unit is destroyed by a melee attack, if that model has not fought this phase, roll one D6, on a 4+, do not remove the destroyed model from play. The destroyed model can fight after the attacking unit has finished making its attacks, and then is removed from play",Imperium - Space Wolves.cat
a9c8-1a6-a0e1-7698:champion-of-the-kingsguard:d65d-22ee-7d91-448a,unit,a9c8-1a6-a0e1-7698,Champion of the Kingsguard,"Each time this model makes a melee attack that targets a CHARACTER unit, you can re-roll the Hit roll and you can re-roll the Wound roll.",Imperium - Space Wolves.cat
fc7c-83a5-7106-41ab:slayer’s-oath:d3d3-265a-32cd-99af,unit,fc7c-83a5-7106-41ab,Slayer’s Oath,"At the start of the battle, select one of the following keywords to be this model's Slayer's Oath: CHARACTER, VEHICLE or MONSTER. The first time this model's unit destroys a unit with this model's Slayer's Oath keyword, if your Detachment has a Saga, until the end of the battle, this model's unit receives the benefits of that Detachment rule as if that Saga had been completed.",Imperium - Space Wolves.cat
fc7c-83a5-7106-41ab:leader:34a6-5bd7-33e-6271,unit,fc7c-83a5-7106-41ab,Leader,"This model can be attached to the following units:

■ Blood Claws
■ Grey Hunters
■ Wolf Guard Headtakers",Imperium - Space Wolves.cat
fc7c-83a5-7106-41ab:oathbound:1ccb-ca03-9256-bd5e,unit,fc7c-83a5-7106-41ab,Oathbound,"While this model is leading a unit, each time a model in that unit makes a melee attack, add 1 to the Hit roll. If that attack targets a unit that has this model's Slayer's Oath keyword (see above), add 1 to the Wound roll as well.",Imperium - Space Wolves.cat
23d2-ea9a-cc45-476:leader:dab2-efea-8c98-814e,unit,23d2-ea9a-cc45-476,Leader,"This model can be attached to the following units:

■ Blood Claws
■ Wolf Guard Headtakers",Imperium - Space Wolves.cat
23d2-ea9a-cc45-476:war-howl:489d-fafc-e8fa-ffd1,unit,23d2-ea9a-cc45-476,War Howl,"While this model is leading a BLOOD CLAWS unit, each time a model in that unit makes a melee attack, you can re-roll the Wound roll. While this model is leading a WOLF GUARD HEADTAKERS UNIT, that unit is eligible to declare a charge in a turn in which it Advanced.",Imperium - Space Wolves.cat
23d2-ea9a-cc45-476:battle-lust:acf6-28b1-da63-60be,unit,23d2-ea9a-cc45-476,Battle-lust,"Each time this model ends a Charge move, until the end of the turn, add 2 to the Attacks characteristics of this model’s Frostfang.",Imperium - Space Wolves.cat
af71-2b1b-2eee-d2be:leader:8839-87e-19fe-cc1a,unit,af71-2b1b-2eee-d2be,Leader,"This model can be attached to the following units:

■ Blood Claws
■ Grey Hunters
■ Wolf Guard",Imperium - Space Wolves.cat
af71-2b1b-2eee-d2be:refuse-to-accept-defeat:88f4-7da8-b865-265b,unit,af71-2b1b-2eee-d2be,Refuse to Accept Defeat,"While this model is leading a unit, each time a model in that unit makes an attack, add 1 to the Hit roll if that unit is below its Starting Strength, and add 1 to the Wound roll as well if that unit is Below Half-strength.",Imperium - Space Wolves.cat
af71-2b1b-2eee-d2be:the-fierce-eye:6826-5564-30f4-5ea2,unit,af71-2b1b-2eee-d2be,The Fierce Eye,"In your Shooting phase, you can select one enemy INFANTRY unit within 12"" of and visible to this model. That enemy unit must take a Battle-shock test.",Imperium - Space Wolves.cat
7d72-63bf-a5f2-bb6c:leader:a794-a4ad-dc6c-4619,unit,7d72-63bf-a5f2-bb6c,Leader,"This model can be attached to the following units:

■ Thunderwolf Cavalry",Imperium - Space Wolves.cat
7d72-63bf-a5f2-bb6c:lord-of-the-wolfkin:2734-7402-ba72-8244,unit,7d72-63bf-a5f2-bb6c,Lord of the Wolfkin,"While this model is leading a unit, each time that unit makes a Charge move, until the end of the turn, crushing teeth and claws equipped by models in that unit have the [DEVASTATING WOUNDS] ability.",Imperium - Space Wolves.cat
7d72-63bf-a5f2-bb6c:mantle-of-the-troll-king:15ef-da73-e7e6-b4b7,unit,7d72-63bf-a5f2-bb6c,Mantle of the Troll King,"Once per phase, when resolving an attack made against this model, after you make a saving throw for this model, you can change the Damage characteristic of that attack to 0.",Imperium - Space Wolves.cat
d63f-bf2c-d38b-58c0:leader:9114-c4e8-32b1-dfe7,unit,d63f-bf2c-d38b-58c0,Leader,"This model can be attached to the following units:

■ Fenrisian Wolves
■ Thunderwolf Cavalry",Imperium - Space Wolves.cat
d63f-bf2c-d38b-58c0:born-of-wolves:2d38-b835-fadf-bfe9,unit,d63f-bf2c-d38b-58c0,Born of Wolves,"While this model is leading a unit, melee weapons equipped by models in that unit have the [SUSTAINED HITS 1] ability.",Imperium - Space Wolves.cat
d63f-bf2c-d38b-58c0:alpha-predator:a9f0-ef79-2a9f-908f,unit,d63f-bf2c-d38b-58c0,Alpha Predator,"Each time this model ends a Charge move, select one enemy unit within Engagement Range of it and roll one D6: on a 2-3, that enemy unit suffers D3 mortal wounds; on a 4-5, that enemy unit suffers 3 mortal wounds; on a 6, that enemy units suffers D3+3 mortal wounds.",Imperium - Space Wolves.cat
bcab-c09a-6584-3b26:leader:229d-f484-6f53-9c8d,unit,bcab-c09a-6584-3b26,Leader,"This model can be attached to the following units:

■ Relic Terminator Squad
■ Terminator Assault Squad
■ Terminator Squad
■ Wolf Guard Terminators

You can attach this model to one of the above units even if one Captain or Chapter Master model has already been attached to it. If you do, and that Bodyguard unit is destroyed, the Leader units attached to it become separate units, with their original Starting Strengths.",Imperium - Space Wolves.cat
